<?xml version="1.0" encoding="UTF-8"?>
<TeeTimesList xmlns:od="urn:schemas-microsoft-com:officedata" xmlns:xsi="http://www.w3.org/2001/XMLSchema-instance"
              xsi:noNamespaceSchemaLocation="TeeTimes.xsd" generated="2021-06-05T13:54:40">
    <TeeTimes>
        <Ctr>13</Ctr>
        <Flight>1</Flight>
        <Slot>1</Slot>
        <TeeTime>4:30</TeeTime>
    </TeeTimes>
    <TeeTimes>
        <Ctr>14</Ctr>
        <Flight>1</Flight>
        <Slot>2</Slot>
        <TeeTime>4:38</TeeTime>
    </TeeTimes>
    <TeeTimes>
        <Ctr>15</Ctr>
        <Flight>1</Flight>
        <Slot>3</Slot>
        <TeeTime>4:46</TeeTime>
    </TeeTimes>
    <TeeTimes>
        <Ctr>16</Ctr>
        <Flight>1</Flight>
        <Slot>4</Slot>
        <TeeTime>4:54</TeeTime>
    </TeeTimes>
    <TeeTimes>
        <Ctr>17</Ctr>
        <Flight>1</Flight>
        <Slot>5</Slot>
        <TeeTime>5:02</TeeTime>
    </TeeTimes>
    <TeeTimes>
        <Ctr>18</Ctr>
        <Flight>1</Flight>
        <Slot>6</Slot>
        <TeeTime>5:10</TeeTime>
    </TeeTimes>
    <TeeTimes>
        <Ctr>19</Ctr>
        <Flight>3</Flight>
        <Slot>1</Slot>
        <TeeTime>4:30</TeeTime>
    </TeeTimes>
    <TeeTimes>
        <Ctr>20</Ctr>
        <Flight>3</Flight>
        <Slot>2</Slot>
        <TeeTime>4:38</TeeTime>
    </TeeTimes>
    <TeeTimes>
        <Ctr>21</Ctr>
        <Flight>3</Flight>
        <Slot>3</Slot>
        <TeeTime>4:46</TeeTime>
    </TeeTimes>
    <TeeTimes>
        <Ctr>22</Ctr>
        <Flight>3</Flight>
        <Slot>4</Slot>
        <TeeTime>4:54</TeeTime>
    </TeeTimes>
    <TeeTimes>
        <Ctr>24</Ctr>
        <Flight>3</Flight>
        <Slot>6</Slot>
        <TeeTime>5:10</TeeTime>
    </TeeTimes>
    <TeeTimes>
        <Ctr>37</Ctr>
        <Flight>2</Flight>
        <Slot>3</Slot>
        <TeeTime>5:34</TeeTime>
    </TeeTimes>
    <TeeTimes>
        <Ctr>38</Ctr>
        <Flight>2</Flight>
        <Slot>4</Slot>
        <TeeTime>5:42</TeeTime>
    </TeeTimes>
    <TeeTimes>
        <Ctr>39</Ctr>
        <Flight>2</Flight>
        <Slot>5</Slot>
        <TeeTime>5:50</TeeTime>
    </TeeTimes>
    <TeeTimes>
        <Ctr>40</Ctr>
        <Flight>2</Flight>
        <Slot>6</Slot>
        <TeeTime>5:58</TeeTime>
    </TeeTimes>
    <TeeTimes>
        <Ctr>43</Ctr>
        <Flight>4</Flight>
        <Slot>3</Slot>
        <TeeTime>5:34</TeeTime>
    </TeeTimes>
    <TeeTimes>
        <Ctr>44</Ctr>
        <Flight>4</Flight>
        <Slot>4</Slot>
        <TeeTime>5:42</TeeTime>
    </TeeTimes>
    <TeeTimes>
        <Ctr>45</Ctr>
        <Flight>4</Flight>
        <Slot>5</Slot>
        <TeeTime>5:50</TeeTime>
    </TeeTimes>
    <TeeTimes>
        <Ctr>46</Ctr>
        <Flight>4</Flight>
        <Slot>6</Slot>
        <TeeTime>5:58</TeeTime>
    </TeeTimes>
    <TeeTimes>
        <Ctr>53</Ctr>
        <Flight>3</Flight>
        <Slot>5</Slot>
        <TeeTime>5:02</TeeTime>
    </TeeTimes>
    <TeeTimes>
        <Ctr>56</Ctr>
        <Flight>2</Flight>
        <Slot>1</Slot>
        <TeeTime>5:18</TeeTime>
    </TeeTimes>
    <TeeTimes>
        <Ctr>57</Ctr>
        <Flight>2</Flight>
        <Slot>2</Slot>
        <TeeTime>5:26</TeeTime>
    </TeeTimes>
    <TeeTimes>
        <Ctr>60</Ctr>
        <Flight>4</Flight>
        <Slot>1</Slot>
        <TeeTime>5:18</TeeTime>
    </TeeTimes>
    <TeeTimes>
        <Ctr>61</Ctr>
        <Flight>4</Flight>
        <Slot>2</Slot>
        <TeeTime>5:26</TeeTime>
    </TeeTimes>
</TeeTimesList>
